{
  "settingId": "spuk_im_gewoelbe",
  "hinweis": "Beobachtungen der Zeugen. Kanal: pflichtgespraech = darf am Tisch erzählt werden (Regel P-1); verborgen = steht im Dossier unter „Was ich verberge“ und erreicht den Detektiv nur über eine Entscheidung oder den Bonus-Hinweis; erzaehler = kommt aus der Detektiv-Mappe oder über den Erzähler. Das Gewölbe hat einen festen Täterpfad, darum gelten alle Beobachtungen in allen Pfaden.",
  "beobachtungen": [
    {
      "id": "b_det_eichentuer",
      "wer": "detective",
      "pfade": "alle",
      "art": "pfadneutral",
      "kanal": "erzaehler",
      "text": "Die Eichentür hat die ganze Zeit niemand von deiner Seite geöffnet. Sie war von innen verkeilt.",
      "beleg": {
        "zeitleiste": [
          "z_2356a"
        ]
      }
    },
    {
      "id": "b_det_geraeusche",
      "wer": "detective",
      "pfade": "alle",
      "art": "pfadneutral",
      "kanal": "erzaehler",
      "text": "Kurz nach dem Knall quietschte drüben eine Tür. Noch vor dem Kettenrasseln der Box hörtest du durch die gesplitterte Tür ein Klimpern, einen tiefen Ruf, einen dumpfen Schlag, Poltern und rollende Dosen. Unter dem Kettenrasseln quietschte die Tür noch einmal. Dann kam der Schrei, direkt neben dir.",
      "beleg": {
        "zeitleiste": [
          "z_2358a",
          "z_0000a"
        ]
      }
    },
    {
      "id": "b_det_merle_verlaufen",
      "wer": "detective",
      "pfade": "alle",
      "art": "pfadneutral",
      "kanal": "erzaehler",
      "text": "Kurz vor dem Schrei sagte Merle drüben am Kamin laut: „Adnan? Ich bin’s, Merle! Ich hab mich total verlaufen.“",
      "beleg": {
        "zeitleiste": [
          "z_2359c"
        ]
      },
      "belastet": [
        "merle"
      ]
    },
    {
      "id": "b_det_merle_darstellung",
      "wer": "detective",
      "pfade": "alle",
      "art": "pfadneutral",
      "kanal": "erzaehler",
      "text": "Merles eigene Darstellung: Sie wollte um acht vor zwölf auf die Toilette und verlief sich bis auf den Wehrgang. Dort sah Jonas sie. Nach dem Knall tastete sie sich die Treppe hinunter und stand beim Schrei neben Adnan.",
      "beleg": {
        "zeitleiste": [
          "z_2352b",
          "z_2354a",
          "z_2359c"
        ]
      }
    },
    {
      "id": "b_det_rojda_kasten",
      "wer": "detective",
      "pfade": "alle",
      "art": "pfadneutral",
      "kanal": "erzaehler",
      "text": "Nach dem Schrei stand Rojda mit Handylicht am offenen Sicherungskasten. Sie sagte: „Ich wollte nur das Licht wieder …“",
      "beleg": {
        "zeitleiste": [
          "z_0000d"
        ]
      }
    },
    {
      "id": "b_det_wachs_hart",
      "wer": "detective",
      "pfade": "alle",
      "art": "pfadneutral",
      "kanal": "erzaehler",
      "text": "In der Speisekammer lag der Burgwart, neben ihm der Kerzenständer. Das Wachs am Boden war schon hart, als du mit Adnan als Erster hereinkamst. In einem Spritzer steckte bereits ein Abdruck.",
      "beleg": {
        "zeitleiste": [
          "z_0000d"
        ]
      }
    },
    {
      "id": "b_det_ultimatum",
      "wer": "detective",
      "pfade": "alle",
      "art": "pfadneutral",
      "kanal": "erzaehler",
      "text": "Um Viertel vor elf hat der Burgwart allen ein Ultimatum gestellt. Bis zwölf soll der Taler in der Blechdose im Regal neben der Eisentür liegen, sonst ruft er die Polizei. Merle rief: „Ich hab ihn doch zurückgegeben!“",
      "beleg": {
        "zeitleiste": [
          "z_2245"
        ]
      }
    },
    {
      "id": "b_det_kamin_muetze",
      "wer": "detective",
      "pfade": "alle",
      "art": "pfadneutral",
      "kanal": "erzaehler",
      "text": "Im Kaminschein kniete jemand mit Mütze und hustete.",
      "beleg": {
        "zeitleiste": [
          "z_2348"
        ]
      },
      "entlastet": [
        "adnan"
      ]
    },
    {
      "id": "b_bw_nie_geschrien",
      "wer": "detective",
      "pfade": "alle",
      "art": "pfadneutral",
      "kanal": "erzaehler",
      "text": "Der Burgwart sagt: „Geschrien? Ich? Dreißig Jahre unter Tage, ich hab nie geschrien.“",
      "beleg": {
        "zeitleiste": [
          "z_0000e"
        ]
      }
    },
    {
      "id": "b_bw_dose_zugepackt",
      "wer": "detective",
      "pfade": "alle",
      "art": "pfadneutral",
      "kanal": "erzaehler",
      "text": "Der Burgwart sagt: „Ich hab im Dunkeln gesessen, die Kerzen hatte ich ausgepustet. Dann hat’s in meiner Dose geklimpert. Da hab ich zugepackt und ‚Hab ich dich!‘ gebrüllt. Gebrüllt, nicht geschrien. Dann war’s dunkel bei mir.“",
      "beleg": {
        "zeitleiste": [
          "z_2346",
          "z_2358f"
        ]
      }
    },
    {
      "id": "b_bw_bett",
      "wer": "detective",
      "pfade": "alle",
      "art": "pfadneutral",
      "kanal": "erzaehler",
      "text": "Der Burgwart sagt: „Ins Bett? Hab ich extra so gesagt. Ich wollt nur gucken, wer den Taler bringt. Nur gucken.“",
      "beleg": {
        "zeitleiste": [
          "z_2335"
        ]
      }
    },
    {
      "id": "b_bw_laken",
      "wer": "detective",
      "pfade": "alle",
      "art": "pfadneutral",
      "kanal": "erzaehler",
      "text": "Der Burgwart sagt: „Was ich am Handgelenk gepackt hab, war ein Laken. Glatter Stoff. Und drunter ein Ärmel, was Gestricktes, Wolle.“",
      "beleg": {
        "zeitleiste": [
          "z_2358f"
        ]
      }
    },
    {
      "id": "b_box_verbindung_getrennt",
      "wer": "detective",
      "pfade": "alle",
      "art": "pfadneutral",
      "kanal": "erzaehler",
      "text": "Um sechs vor zwölf dröhnte die Box „Verbindung getrennt“. Jonas’ Handy hatte den Funkbereich des Gewölbes verlassen. Schon um halb neun hatte seine Begrüßung dreifach aus der Box gehallt: „Die Miete ist bezahlt!“",
      "beleg": {
        "zeitleiste": [
          "z_2030",
          "z_2354b"
        ]
      }
    },
    {
      "id": "b_bw_im_turm",
      "wer": "detective",
      "pfade": "alle",
      "art": "pfadneutral",
      "kanal": "erzaehler",
      "text": "Um Viertel vor zwölf stieg der Burgwart in den Turm, wie die Raureifspuren zeigen. Da war er noch munter. Das bringt dich nicht weiter.",
      "beleg": {
        "zeitleiste": [
          "z_2344",
          "z_2345"
        ]
      }
    },
    {
      "id": "b_schrei_hypothese",
      "wer": "detective",
      "pfade": "alle",
      "art": "pfadneutral",
      "kanal": "erzaehler",
      "text": "Wenn es beim Schrei passierte, hatten Merle und Adnan ein Alibi, Rojda und Jonas nicht. Die Liste wird kurz, aber stimmt sie auch?",
      "beleg": {
        "zeitleiste": [
          "z_0000a"
        ]
      }
    },
    {
      "id": "b_tatzeit_nach_knall",
      "wer": "detective",
      "pfade": "alle",
      "art": "pfadneutral",
      "kanal": "erzaehler",
      "text": "Alles fügt sich. Gleich nach dem Knall klimperte die Dose, der Burgwart brüllte „Hab ich dich!“, dann kamen Schlag und Poltern, alles vor den Ketten. Der Schrei um Mitternacht war die Box. Wer für den Schrei ein Alibi hat, hat für die Tat keins.",
      "beleg": {
        "zeitleiste": [
          "z_2358a",
          "z_2358f",
          "z_0000a"
        ]
      }
    },
    {
      "id": "b_merle_alibi_nur_schrei",
      "wer": "detective",
      "pfade": "alle",
      "art": "pfadneutral",
      "kanal": "erzaehler",
      "text": "Um sechs vor zwölf war Merle auf dem Wehrgang, bei Adnan am Kamin erst kurz vor dem Schrei. Das sind fünf Minuten für eine Treppe. Ihr Alibi gilt nur für den Schrei. Und wer im Streich mitspielte, wusste, wann der Schrei kommt.",
      "beleg": {
        "zeitleiste": [
          "z_2354a",
          "z_2359c"
        ]
      },
      "belastet": [
        "merle"
      ]
    },
    {
      "id": "b_adnan_russ",
      "wer": "adnan",
      "pfade": "alle",
      "art": "pfadneutral",
      "kanal": "pflichtgespraech",
      "text": "Adnan hat seit dem Kamin Ruß an Händen und Gesicht. Den Kerzenständer hat er nicht angefasst.",
      "duText": "Du hast seit dem Kamin Ruß an Händen und Gesicht. Den Kerzenständer hast du nicht angefasst.",
      "beleg": {
        "zeitleiste": [
          "z_2352a"
        ]
      },
      "entlastet": [
        "adnan"
      ]
    },
    {
      "id": "b_adnan_code_warnung",
      "wer": "adnan",
      "pfade": "alle",
      "art": "pfadneutral",
      "kanal": "pflichtgespraech",
      "text": "Adnan hat den Code des Sicherungskastens für jemand anderen aufgeschrieben, mit der Warnung, vorher Kessel und Heizstrahler auszuschalten.",
      "duText": "Du hast den Code des Sicherungskastens für jemand anderen aufgeschrieben, mit der Warnung, vorher Kessel und Heizstrahler auszuschalten.",
      "beleg": {
        "zeitleiste": [
          "z_1830"
        ]
      },
      "widerlegt": [
        "luege_adnan_code"
      ],
      "entlastet": [
        "adnan"
      ]
    },
    {
      "id": "b_adnan_kamin",
      "wer": "adnan",
      "pfade": "alle",
      "art": "pfadneutral",
      "kanal": "pflichtgespraech",
      "text": "Adnan kniete vom Qualm bis zum Schrei am Kamin. Nur um acht vor zwölf sprang er kurz auf und riss Turmtür und Läden auf.",
      "duText": "Du hast vom Qualm bis zum Schrei am Kamin gekniet. Nur um acht vor zwölf bist du kurz aufgesprungen und hast Turmtür und Läden aufgerissen.",
      "beleg": {
        "zeitleiste": [
          "z_2348",
          "z_2352a"
        ]
      },
      "entlastet": [
        "adnan"
      ]
    },
    {
      "id": "b_adnan_merle_spaet",
      "wer": "adnan",
      "pfade": "alle",
      "art": "pfadneutral",
      "kanal": "pflichtgespraech",
      "text": "Kurz vor dem Schrei stand Merle plötzlich neben Adnan, außer Atem, mit eiskalten Händen. Sie sagte laut, sie habe sich verlaufen.",
      "duText": "Kurz vor dem Schrei stand Merle plötzlich neben dir, außer Atem, mit eiskalten Händen. Sie sagte laut, sie habe sich verlaufen.",
      "beleg": {